{
  "schema_version": "guardian.monitor.v1",
  "mode": "read_only",
  "enabled_networks": [
    "ethereum-mainnet",
    "bsc-mainnet",
    "arbitrum-one",
    "base-mainnet",
    "optimism-mainnet",
    "polygon-pos",
    "avalanche-c",
    "solana-mainnet",
    "bitcoin-mainnet"
  ],
  "private_inputs": {
    "accounts_file_env": "MONITOR_ACCOUNTS_FILE",
    "state_dir_env": "MONITOR_STATE_DIR",
    "secret_profile_file_env": "MONITOR_SECRET_PROFILE"
  },
  "polling": {
    "interval_seconds": 10800,
    "around_the_clock": true,
    "discovery_interval_seconds": 86400,
    "bootstrap_lookback_days": 30,
    "bootstrap_request_cap": 2000,
    "webhooks_enabled": false
  },
  "alerts": {
    "native_eth_threshold": "0.5",
    "asset_usd_threshold": "1000",
    "threshold_operator": "any",
    "permission_changes": true,
    "exposure_risk_changes": true,
    "exposure_news_only": true,
    "generic_news": false,
    "unknown_price_policy": "show_unknown_not_zero",
    "baseline_policy": "initial_summary_and_existing_risk_not_new_history",
    "quiet_if_no_change": true,
    "monitor_health_changes": true
  },
  "sources": {
    "etherscan": {
      "adapter": "etherscan_v2",
      "endpoint_env": "ETHERSCAN_API_BASE",
      "credential_env": "ETHERSCAN_API_KEY",
      "budget_group": "etherscan-account",
      "enabled": true
    },
    "rpc-ethereum-mainnet": {
      "adapter": "evm_rpc",
      "endpoint_env": "RPC_ETHEREUM_MAINNET_URL",
      "budget_group": "rpc-ethereum-mainnet",
      "enabled": true
    },
    "rpc-bsc-mainnet": {
      "adapter": "evm_rpc",
      "endpoint_env": "RPC_BSC_MAINNET_URL",
      "budget_group": "rpc-bsc-mainnet",
      "enabled": true
    },
    "rpc-arbitrum-one": {
      "adapter": "evm_rpc",
      "endpoint_env": "RPC_ARBITRUM_ONE_URL",
      "budget_group": "rpc-arbitrum-one",
      "enabled": true
    },
    "rpc-base-mainnet": {
      "adapter": "evm_rpc",
      "endpoint_env": "RPC_BASE_MAINNET_URL",
      "budget_group": "rpc-base-mainnet",
      "enabled": true
    },
    "rpc-optimism-mainnet": {
      "adapter": "evm_rpc",
      "endpoint_env": "RPC_OPTIMISM_MAINNET_URL",
      "budget_group": "rpc-optimism-mainnet",
      "enabled": true
    },
    "rpc-polygon-pos": {
      "adapter": "evm_rpc",
      "endpoint_env": "RPC_POLYGON_POS_URL",
      "budget_group": "rpc-polygon-pos",
      "enabled": true
    },
    "rpc-avalanche-c": {
      "adapter": "evm_rpc",
      "endpoint_env": "RPC_AVALANCHE_C_URL",
      "budget_group": "rpc-avalanche-c",
      "enabled": true
    },
    "rpc-solana-mainnet": {
      "adapter": "solana_rpc",
      "endpoint_env": "RPC_SOLANA_MAINNET_URL",
      "budget_group": "rpc-solana-mainnet",
      "enabled": true
    },
    "esplora-bitcoin": {
      "adapter": "esplora",
      "endpoint_env": "ESPLORA_API_URL",
      "budget_group": "esplora-bitcoin",
      "enabled": true
    },
    "helius-parser": {
      "adapter": "helius_parsed_events",
      "endpoint_env": "HELIUS_PARSED_EVENTS_URL",
      "credential_env": "HELIUS_API_KEY",
      "budget_group": "helius-account",
      "enabled": true
    },
    "goplus": {
      "adapter": "goplus",
      "endpoint_env": "GOPLUS_API_BASE",
      "credential_env": "GOPLUS_API_KEY",
      "budget_group": "goplus-account",
      "enabled": true
    },
    "ofac": {
      "adapter": "ofac_sls",
      "endpoint_env": "OFAC_SLS_FEED",
      "budget_group": "public-feeds",
      "enabled": true
    },
    "prices": {
      "adapter": "coingecko",
      "endpoint_env": "COINGECKO_API_BASE",
      "budget_group": "price-account",
      "enabled": true
    },
    "nodereal-bsc": {
      "adapter": "nodereal_transfers",
      "endpoint_env": "NODEREAL_BSC_URL",
      "credential_env": "NODEREAL_API_KEY",
      "budget_group": "nodereal-key",
      "enabled": true
    },
    "blockscout-base": {
      "adapter": "blockscout",
      "endpoint_env": "BLOCKSCOUT_BASE_URL",
      "credential_env": "BLOCKSCOUT_BASE_API_KEY",
      "budget_group": "blockscout-base",
      "enabled": true,
      "method_credits": 20
    },
    "blockscout-optimism": {
      "adapter": "blockscout",
      "endpoint_env": "BLOCKSCOUT_OPTIMISM_URL",
      "credential_env": "BLOCKSCOUT_OPTIMISM_API_KEY",
      "budget_group": "blockscout-optimism",
      "enabled": true,
      "method_credits": 20
    },
    "blockscout-pro": {
      "adapter": "blockscout",
      "endpoint_env": "BLOCKSCOUT_PRO_API_BASE",
      "credential_env": "BLOCKSCOUT_API_KEY",
      "budget_group": "blockscout-pro",
      "enabled": true,
      "method_credits": 20
    },
    "blockscout-eth-public": {
      "adapter": "blockscout",
      "endpoint_env": "BLOCKSCOUT_ETH_URL",
      "budget_group": "blockscout-eth-public",
      "enabled": true,
      "method_credits": 20
    },
    "blockscout-base-public": {
      "adapter": "blockscout",
      "endpoint_env": "BLOCKSCOUT_BASE_PUBLIC_URL",
      "budget_group": "blockscout-base-public",
      "enabled": true,
      "method_credits": 20
    },
    "blockscout-optimism-public": {
      "adapter": "blockscout",
      "endpoint_env": "BLOCKSCOUT_OPTIMISM_PUBLIC_URL",
      "budget_group": "blockscout-optimism-public",
      "enabled": true,
      "method_credits": 20
    },
    "blockscout-arbitrum-public": {
      "adapter": "blockscout",
      "endpoint_env": "BLOCKSCOUT_ARBITRUM_URL",
      "budget_group": "blockscout-arbitrum-public",
      "enabled": true,
      "method_credits": 20
    },
    "blockscout-polygon-public": {
      "adapter": "blockscout",
      "endpoint_env": "BLOCKSCOUT_POLYGON_URL",
      "budget_group": "blockscout-polygon-public",
      "enabled": true,
      "method_credits": 20
    },
    "alchemy-base": {
      "adapter": "alchemy_transfers",
      "endpoint_env": "ALCHEMY_TRANSFERS_URL",
      "credential_env": "ALCHEMY_API_KEY",
      "budget_group": "alchemy-base",
      "enabled": true,
      "method_credits": 120
    },
    "tenderly_base": {
      "adapter": "evm_rpc",
      "endpoint_env": "TENDERLY_BASE_URL",
      "budget_group": "tenderly-base",
      "enabled": true,
      "range_limit": 1000
    },
    "base-1rpc": {
      "adapter": "evm_rpc",
      "endpoint_env": "BASE_1RPC_URL",
      "budget_group": "base-1rpc",
      "enabled": false,
      "range_limit": 50
    }
  },
  "routing": [
    {
      "network": "ethereum-mainnet",
      "capability": "balances.native",
      "source_ids": [
        "rpc-ethereum-mainnet"
      ]
    },
    {
      "network": "ethereum-mainnet",
      "capability": "history.token",
      "source_ids": [
        "rpc-ethereum-mainnet"
      ]
    },
    {
      "network": "ethereum-mainnet",
      "capability": "permissions.standard",
      "source_ids": [
        "rpc-ethereum-mainnet"
      ]
    },
    {
      "network": "ethereum-mainnet",
      "capability": "history.native_external",
      "source_ids": [
        "etherscan",
        "blockscout-eth-public",
        "rpc-ethereum-mainnet"
      ]
    },
    {
      "network": "bsc-mainnet",
      "capability": "balances.native",
      "source_ids": [
        "rpc-bsc-mainnet"
      ]
    },
    {
      "network": "bsc-mainnet",
      "capability": "history.token",
      "source_ids": [
        "rpc-bsc-mainnet"
      ]
    },
    {
      "network": "bsc-mainnet",
      "capability": "permissions.standard",
      "source_ids": [
        "rpc-bsc-mainnet"
      ]
    },
    {
      "network": "bsc-mainnet",
      "capability": "history.native_external",
      "source_ids": [
        "nodereal-bsc"
      ]
    },
    {
      "network": "arbitrum-one",
      "capability": "balances.native",
      "source_ids": [
        "rpc-arbitrum-one"
      ]
    },
    {
      "network": "arbitrum-one",
      "capability": "history.token",
      "source_ids": [
        "rpc-arbitrum-one"
      ]
    },
    {
      "network": "arbitrum-one",
      "capability": "permissions.standard",
      "source_ids": [
        "rpc-arbitrum-one"
      ]
    },
    {
      "network": "arbitrum-one",
      "capability": "history.native_external",
      "source_ids": [
        "etherscan",
        "blockscout-arbitrum-public",
        "rpc-arbitrum-one"
      ]
    },
    {
      "network": "base-mainnet",
      "capability": "balances.native",
      "source_ids": [
        "rpc-base-mainnet"
      ]
    },
    {
      "network": "base-mainnet",
      "capability": "history.token",
      "source_ids": [
        "tenderly_base",
        "base-1rpc"
      ]
    },
    {
      "network": "base-mainnet",
      "capability": "permissions.standard",
      "source_ids": [
        "tenderly_base",
        "base-1rpc"
      ]
    },
    {
      "network": "base-mainnet",
      "capability": "history.native_external",
      "source_ids": [
        "alchemy-base",
        "blockscout-pro",
        "blockscout-base-public",
        "blockscout-base"
      ]
    },
    {
      "network": "optimism-mainnet",
      "capability": "balances.native",
      "source_ids": [
        "rpc-optimism-mainnet"
      ]
    },
    {
      "network": "optimism-mainnet",
      "capability": "history.token",
      "source_ids": [
        "rpc-optimism-mainnet"
      ]
    },
    {
      "network": "optimism-mainnet",
      "capability": "permissions.standard",
      "source_ids": [
        "rpc-optimism-mainnet"
      ]
    },
    {
      "network": "optimism-mainnet",
      "capability": "history.native_external",
      "source_ids": [
        "blockscout-pro",
        "blockscout-optimism-public",
        "blockscout-optimism"
      ]
    },
    {
      "network": "polygon-pos",
      "capability": "balances.native",
      "source_ids": [
        "rpc-polygon-pos"
      ]
    },
    {
      "network": "polygon-pos",
      "capability": "history.token",
      "source_ids": [
        "rpc-polygon-pos"
      ]
    },
    {
      "network": "polygon-pos",
      "capability": "permissions.standard",
      "source_ids": [